### ISSUE TITLE
AD login not functional.

### ISSUE THREAD

**Issue by Collisio-Adolebitque** [snipe/snipe-it#3317]
#### Expected Behavior 

Successful login with valid AD credentials.

-----

#### Actual Behavior

Incorrect username or password error.

-----

#### Please confirm you have done the following before posting your bug report:

- [ X ] I have enabled debug mode
- [ X ] I have read [checked the Common Issues page](https://snipe-it.readme.io/docs/common-issues)

-----
#### Please provide answers to these questions before posting your bug report:

- Version of Snipe-IT you're running: **3.6.3 build 15**
- What OS and web server you're running Snipe-IT on: **RHEL 7.3 / Apache 2.**
- What method you used to install Snipe-IT (install.sh, manual installation, docker, etc): **install.sh**
- WITH DEBUG TURNED ON, if you're getting an error in your browser, include that error: **N/A. No browser error**
- What specific Snipe-IT page you're on, and what specific element you're interacting with to trigger the error: **http://snipe-it/login - Trying to log in.**
- If a stacktrace is provided in the error, include that too.: **N/A. No browser error**
- Any errors that appear in your browser's error console.: **N/A. No browser error**
- Confirm whether the error is [reproduceable on the demo](https://snipeitapp.com/demo).: **N/A. Demo not connected to my AD instance**
- Include any additional information you can find in `app/storage/logs` and your webserver's logs.:

```
[bAdmin@am-server snipe-it]$ cat storage/logs/laravel.log | grep "2017-02-20.*LDAP"
[2017-02-20 09:42:35] production.ERROR: There was an error authenticating the LDAP user: Could not find user in LDAP directory  
[2017-02-20 09:52:59] production.ERROR: There was an error authenticating the LDAP user: Could not find user in LDAP directory  
[2017-02-20 10:14:47] production.ERROR: There was an error authenticating the LDAP user: Could not find user in LDAP directory  
[2017-02-20 10:14:58] production.ERROR: There was an error authenticating the LDAP user: Could not find user in LDAP directory  
[2017-02-20 10:31:27] production.ERROR: There was an error authenticating the LDAP user: Could not find user in LDAP directory  
[2017-02-20 10:31:35] production.ERROR: There was an error authenticating the LDAP user: Could not find user in LDAP directory  
[2017-02-20 10:43:55] production.ERROR: There was an error authenticating the LDAP user: Could not find user in LDAP directory  
[2017-02-20 10:44:07] production.ERROR: There was an error authenticating the LDAP user: Could not find user in LDAP directory  
```

- Include what you've done so far in the installation, and if you got any error messages along the way.: **Added LDAP config and enabled LDAP password Sync. Successfully imported users from AD, then Attempted to log in with known good credentials.**
- Indicate whether or not you've manually edited any data directly in the database: **No manual DB edits.**

**Comment by Collisio-Adolebitque** [comment]
LDAP test works.

![image](https://cloud.githubusercontent.com/assets/25212666/23122218/34478bd6-f75b-11e6-897a-0bb85ec9e2e4.png)

**Comment by Collisio-Adolebitque** [comment]
Tried multiple logins with the same user to see if I could lock the account out.  Seems like the auth requests are never making it to the AD DC.

**Comment by Collisio-Adolebitque** [comment]
Ran a quick tcpdump on the host during login attempts and only DNS traffic is going to the DC.
```
[bAdmin@am-server certs]$ sudo tcpdump -i eth1 | grep 192.168.192.170
tcpdump: verbose output suppressed, use -v or -vv for full protocol decode
listening on eth1, link-type EN10MB (Ethernet), capture size 65535 bytes
13:56:14.005347 IP msaddc01.lab.local > am-server.lab.local.54948: 1925* 1/0/0 A 192.168.192.170 (55)
13:56:23.033473 IP msaddc01.lab.local > am-server.lab.local.56464: 16133* 1/0/0 A 192.168.192.170 (55)
13:57:11.213130 IP msaddc01.lab.local > am-server.lab.local.35237: 64309* 1/0/0 A 192.168.192.170 (55)
^C308 packets captured
312 packets received by filter
0 packets dropped by kernel

[bAdmin@am-server certs]$ cat /data/web-app/snipe-it/storage/logs/laravel.log | tail
#88 {main}  
[2017-02-20 13:35:49] production.ERROR: There was an error authenticating the LDAP user: Could not find user in LDAP directory  
[2017-02-20 13:35:59] production.ERROR: There was an error authenticating the LDAP user: Could not find user in LDAP directory  
[2017-02-20 13:36:14] production.ERROR: There was an error authenticating the LDAP user: Could not find user in LDAP directory  
[2017-02-20 13:36:21] production.ERROR: There was an error authenticating the LDAP user: Could not find user in LDAP directory  
[2017-02-20 13:36:26] production.ERROR: There was an error authenticating the LDAP user: Could not find user in LDAP directory  
[2017-02-20 13:55:28] production.ERROR: There was an error authenticating the LDAP user: Could not find user in LDAP directory  
[2017-02-20 13:56:14] production.ERROR: There was an error authenticating the LDAP user: Could not find user in LDAP directory  
[2017-02-20 13:56:23] production.ERROR: There was an error authenticating the LDAP user: Could not find user in LDAP directory  
[2017-02-20 13:57:11] production.ERROR: There was an error authenticating the LDAP user: Could not find user in LDAP directory  
```

**Comment by Collisio-Adolebitque** [comment]
LDAP Bind User string set to lab\svc-ad-read-only

**Comment by Collisio-Adolebitque** [comment]
Changed the LDAP Bind ID to svc-ad-read-only@lab.local and get the same issue: in the laravel.log:

`[2017-02-22 14:31:48] production.ERROR: There was an error authenticating the LDAP user: Could not find user in LDAP directory [2017-02-22 14:32:02] production.ERROR: There was an error authenticating the LDAP user: Could not find user in LDAP directory`

**Comment by snipe** [comment]
That is usually a byproduct of your auth query not being correct.

**Comment by g33kphr33k** [comment]
Confirming the issue.

`[2017-05-02 14:14:12] production.ERROR: There was an error authenticating the LDAP user: Could not find user in LDAP directory
`
Users that are imported need to do a password reset to enable login which is incorrect behaviour.

**Comment by machobymb** [comment]
Hi!
My problem is this:
I create LDAP auth. settings, the sync is perfect, but I've problem with login.
LDAP server is a Groupwise server.
My system is Debian 8.5, the created local admin login work fine.
Snipe IT: 3.6.4

DEBUG on, Laravel error:
LDAP user xxx not found in LDAP or cloud not bind
There was an error authenticating the LDAP user: Could not find user in LDAP directory
Authenticating user againts database
Local authentication failed
![si](https://cloud.githubusercontent.com/assets/28394078/25707967/651c18da-30e5-11e7-9830-8579309bc261.png)

Thx help!

**Comment by renjithtr** [comment]
I am using Unintentional Corporate severer as LDAP . And I can Successfully sync userr from LDAP but failed to login using LDAP users. logs shows the below error.

production.ERROR: There was an error authenticating the LDAP user: Could not find user in LDAP directory 

And I tried below options in LDAP authentication Query field 

uid 
uid=
cn=
users=
cn=users 
SamAccoutName
samaccoutname

**Comment by herrfricc** [comment]
Hello!

I have the same issue:
[2018-03-29 08:20:21] production.ERROR: There was an error authenticating the LDAP user: Could not find user in LDAP directory
[2018-03-29 08:21:10] production.ERROR: There was an error authenticating the LDAP user: Could not find user in LDAP directory
[2018-03-29 08:24:58] production.ERROR: There was an error authenticating the LDAP user: Could not find user in LDAP directory
[2018-03-29 08:28:20] production.ERROR: There was an error authenticating the LDAP user: Could not find user in LDAP directory

![kepernyokep_2018-03-29_10-41-03](https://user-images.githubusercontent.com/37897044/38078952-542e9aa2-332d-11e8-88ff-7c1f30889d97.png)

I use OpenLDAP, user sync is working, but login with LDAP user isn't.

**Comment by renjithtr** [comment]
Hi ,
Please try below settings.
Server : name.server.com/ip
bindusername : uid=adminusername,cn=users,dc=server,dc=com
password : AdminPassword
Base Bind DN : dc=server,dc=com
Ldap Filter : &(cn=*)
User name field : samaccountname
Last Name : sn
LDAP First Name : givenname
LDAP Authentication query : cn=
LDAP Version : 0
LDAP Active Flag : NIL
LDAP Employee Number : NIL
LDAP Email : mail

Also select first 3 options

**Comment by herrfricc** [comment]
Doesn't work, i have the same issue like earlier.

**Comment by herrfricc** [comment]
Ahhh, finally it works. 
The problem was the Base Bind DN.

**Comment by renjithtr** [comment]
ahha good

**Comment by snipe** [comment]
> The problem was the Base Bind DN.

It usually is
